390,Banjir,6/12/2013,22.00 WITA,120.276,-2.71775,"Ds. Wara,Ds. Limbong Wara, Ds. Cenning, Ds. Klitata, Ds. Waelawi, Ds. Arusu, Ds. Pole Jiwa, Ds. Pombakka Kec. Malangke Barat Ds. Sumpira, Ds. Polewali, Ds. Mukti Tama, Ds. Lara, Ds. Mario, Ds. Marannu, Ds. Lembang-lembang, Ds. Beringin Jaya, Kec. Baebunta. Ds. Tandung, Ds. Petta Landung, Kec. Sabbang, Kab. Luwu Utara, Prov. Sulawesi Selatan.",Korban Jiwa : Nihil,"Kerugian Materil : Rumah dan pekarangan warga terendam, Lahan perkebunan, lahan pertanian, infrastruktur dan fasilitas umum terendam. Kondisi Muktahir : Pengungsi sebanyak 357 KK (Ds Beringin Jaya 210 KK, Ds. Cenning 81 KK, Ds. Limbong Wara 67 KK dan Ds. Petta Landung 5 KK) Tergenang air sebanyak 3.482 KK. TMA mencapai 100 cm s/d 150 KK.","Kronologis : Tingginya curah hujan disertai angin kencang yang terjadi sejak sore mengakibatkan meluapnya sungai Rongkong, Kec. Sabbang, Kab. Luwu Utara. Telah disalurkan bantuan Tanggap Darurat berupa logistik (sandang pangan) sesuai dengan kemampuan keuangan daerah yang dialokasikan dalam DPA BPBD Kab. Luwu Utara TA. 2013 serta mendirikan tenda dilokasi bencana untuk menampung korban banjir. Melakukan koordinasi dengan instansi terkait dengan upaya Penanganan Darurat Bencana dan Penanganan Pasca Bencana. Kebutuhan Mendesak : Dana Siap Pakai (DSP) Tanggap Darurat. Kebutuhan Sarana dan Prasarana (Perahu Karet dan Mobil Dapur Umum) Kebutuhan Logistik (Sandang Pangan) dan Air Bersih. Pembangunan Tanggul Penahan banjir dan Normalisasi Sungai.",,,,,,,,,,,
391,Banjir,6/11/2013,14.30 WITA,122.422,-5.21951,Desa Kotawo Ds. Kasulatobi Kec. Kalisusu Kec. Langkumbe Kec. Kalisusu Barat Kec. Bonegunu Kab. Buton Utara Prov. Sulawesi Tenggara,nihil,- Area sawah tergenang 50 Ha terancam gagal panen - Ratusan kubik kayu hanyut - 2000 biji kelapa hanyut,Kronologis: - Curah hujan yang tinggi dan lama sehingga kali Meluap. Upaya: - BPBD setempat melakukan pendataan jenis kerusakan,,,,,,,,,,,
392,Banjir,6/11/2013,09.00 WITA,117.136,-0.5342,Kec. Senpaja utara Kec. Sungai Pinang Kec. Samarinda Ulu Kec. Sungai Kunjang Kec. Samarinda hulu Kota Samarinda Prov. Kalimantan Timur,nihil,masih dalam tahap pendataan,Kondisi Mutakhir: - Kec. Senpaja utara 90 cm - Kec. Sungai Pinang 30 cm - Kec. Samarinda Ulu 50 cm - Kec. Sungai Kunjang 50 cm - Kec. Samarinda Hulu 40cm Kronologis: - Curah hujan yang tinggi dari pagi pukul 04.30 WITA dan banjir pkl. 09.00 WITA Upaya: - Mengevakuasi masyarakat dengan perahu rakit Kendala: - Belum ada perahu karet,,,,,,,,,,,
393,Banjir,6/11/2013,. 10.23 WITA,122.633,-5.46691,Kec. Bungi Kota Bau-Bau Prov. Sulawesi tenggara,nihil,- Mengenangi dan merusak sawah petani yang sudah mulai dapat dipanen seluas ± 253 Ha - 7 rumah tergenang,"Kronologis: - Curah hujan yang tinggi Upaya: - BPBD Kota Bau-Bau telah melakukan langkah-langkah penangangan dengan instansi terkait, dinas pertanian dan dinas sosial",,,,,,,,,,,
394,Banjir,6/11/2013,. 10.23 WITA,122.633,-5.46691,Kec. Bungi Kota Bau-Bau Prov. Sulawesi tenggara,nihil,- Mengenangi dan merusak sawah petani yang sudah mulai dapat dipanen seluas ± 253 Ha - 7 rumah tergenang,"Kronologis: - Curah hujan yang tinggi Upaya: - BPBD Kota Bau-Bau telah melakukan langkah-langkah penangangan dengan instansi terkait, dinas pertanian dan dinas sosial",,,,,,,,,,,
395,Banjir,6/11/2013,02.00 WIB,113.466,-7.1669,Kec. Pamekasan Kec. Pademawu Kab. Pamekasan Prov. Jawa Timur,nihil,Genangan jalan abdul Aziz dan di desa-desa setinggi 30-40 cm,"Kronologis: - Curah hujan yang tinggi yang menyebabkan kali Patemon meluap. Tinggi bervariasi sekitar 30-40 cm Upaya: - BPBD kab. sampang, Polres dan Kodim pamekasan bersama-sama melakukan identifikasi dan survei lingkungan.",,,,,,,,,,,
396,Banjir,6/11/2013,03.00 WIB,113.252,-7.2146,Ds. Panggung Ds. Tatian Ds. Tanggumung Kel. denpenang Kel. Karang dalam Kel. Long tengah Kel. Gunung sekar Kec. Sampang Kab. Sampang Prov.Jawa Timur,nihil,- Jl. Panglima Soedirman tergenang 30 cm - Jl. Imam Bonjol tergenang 40 cm - Jl. Mawar 50 cm - Jl. Melati 60 cm,"Kondisi Mutakhir: - TMA 60 cm - Saat ini, selasa, 11 Juni 2013 pkl. 07.00 WIB tinggi genangan sekitar 40 cm Kronologis: - Curah hujan yang tinggi yang menyebabkan kali kamoning meluap, sehingga meluber ke jalan-jalan, TMA bervariasi 40-60 cm Upaya: - BPBD Kab. Sampang melakukan identivikasi dan survei lapangan - Sudah membagikan nasi bungkus kemarin",,,,,,,,,,,
397,Banjir,6/11/2013,16.15 WIB,110.008,-7.70973,"Rt. 004 Rw. 14, Gg. Plaosan, Kel. Purworejo, Kec. Purworejo, Kab. Purworejo, Prov. Jawa Tengah",Nihil,Kerugian Materil: - Tanggul sepanjang 8 meter tinggi 2 meter jebol. - 2 unit rumah terendam air dengan ketinggian 60 cm - ± Rp. 10.000.000 Pengungsi: - 1 Keluarga (6 jiwa) a.n Siti Asiyah 70th,"Kronologis: - Akibat intensitas hujan sangat tinggi pada hari Selasa, 11 Juni 2013 sore pkl. 15.00 WIB, mengakibatkan permukaan sungai Kedung Putri meningkat dan masuk saluran pembuangan dengan volume besar sehingga tanggul saluran di Plaosan Gg. IV tidak mampu menampung debit air Upaya: - Menutup pintu air yang masuk ke saluran pembuangan - Menyingkirkan puing-puing tanggul supaya air tidak masuk rumah warga - Melakukan kerja bakti bersama masyarakat, aparat TNI, POLRI membuat tanggul darurat serta membersihkan lumpur didalam rumah yang terdampak",,,,,,,,,,,
398,Banjir,6/10/2013,01.00 WIB,98.6743,3.58345,"Maimun, Kec. Medan, Kota Medan, Prov. Sumatera Utara",Korban Jiwa : 1.206 KK/3.625 jiwa,Kerugian Materil : 1.206 rumah terendam 1 Masjid terendam (Masjid Jamiq) Kondisi Muktahir : TMA 2 meter.,"Kronologis : Hujan deras pada hari Minggu, 09-06-2013 pukul 19.00 WIB hingga pukul 22.00 WIB. Sungai Deli yang membelah KOta Medan meluap dan ditambah hujan berkepanjangan. Upaya : BPBD Kota Medan melakukan pendataan dan menyiapkan makan siang sebanyak 3000 nasi bungkus.",,,,,,,,,,,
399,Banjir,6/10/2013,15.20 WITA,120.104,-5.20874,"Sungai Kalimasu, Desa Aska, Kec. Sinjai Timur, Kab. Sinjai, Prov. Sulawesi Selatan",Korban Jiwa : 1 orang (a.n Taufiq/L/6 tahun) tercebur di sungai Kalamisu,Kerugian Materil : NIhil,"Kronologis : Korban sedang menyeberang Sungai Kalimisu bersama ayahnya, lalu tepat dipertengahan sungai korban terpeleset dan jatuh kedalam sungai. Upaya : Pencarian akan dilakukan besok harinya pada pukul 07.00 WITA dengan melakukan penyisiran menggunakan perahu karet sejauh 10 km. BPBD Bone, BPBD Sinjai, TNI, SAR Sinjai dan masyarakat turut membantu upaya pencarian. Kendala : Kondisi cuaca yang sedang turun hujan deras dan kondisi yang gelap tidak memungkinkan dilakukannya pencarian dengan cepat.",,,,,,,,,,,
400,Banjir,6/10/2013,01.00 WIB,113.907,-6.99936,Ds. Baraji Kec. Gapura Kab. Sumenep Prov. Jawa Timur,nihil,- Jembatan sepanjang 200 meter yang menghubungkan ds. Braji dan Ds. Poja rusak ambrol - Warga terpaksa memutar sekitar 5 km - Para siswa terhambat guna akses sekolah,Kronologis: - Akibat guyuran hujan lebat dan hantaman derasnya arus sungai Upaya: - BPBD Kab. sumenep melakukan identivikasi dan survei lapangan,,,,,,,,,,,
401,Banjir,6/9/2013,18.00 WIB,112.776,-7.60185,"Ds. Bendungan dan Ds. Pulokerto, Kec. Kraton. Ds. Kalirejo dan Ds. Tambakan, Kec. Bangil. Kab. Pasuruan, Prov. Jawa Timur",Korban Jiwa : Nihil,"Kerugian Materil : Di Kec. Kraton, Desa Bendungan terdapat 200 KK terkena dampak banjir, sedangkan di Desa Pulokerto terdapat 600 KK terkena dampak banjir. KOndisi Muktahir : air sudah surut.",Kronologis : Hujan deras yang merata di daerah sebelah Barat serta Selatan Kab. Pasuruan merupakan penyebab banjir. Upaya : BPBD bersama TNI dan Relawan mengantisipasi kemungkinan evakuasi warga. BPBD sudah mendirikan Posko Kesehatan dan TRC dilokasi yang aman.,,,,,,,,,,,
402,Banjir,6/9/2013,19.00 WITA,117.598,-8.79823,"Ds. Umatoos, Fafoe, Umalor, Lasaen, Rabasahain, Sikundar Oan Mane, Motaulun, dan Moatain Kec. Malaka Barat Kab. DOB Malaka Prov. Nusa Tenggara Timur",nihil,"- Ds. Umatoosada 780 rmh terendam, 6 rmh RB, 2 rumah roboh - Ternak babi, ayam dan kambing hilang terbawa arus.","Kronologis: - Sungai di Benenain meluap akibat hujan selama beberapa hari berturut-turut Upaya: - Saat ini, situasi dan kondisi di wilayah terkena bencana banjir sudah surut. BPBD Kab. Belu setempat menghimbau warga untuk tetap waspada terhadap kemungkinan banjir datang kembali - SelasaTgl 11 Juni 2013, BPBD Prov. NTT telah memberikan bantuan logistik berupa Beras 520 kg, Kopi 5 ball, Gula 50 kg, The 576 saset, Bimoli 24 liter, bersumber dari dana APBD dan Peralatan dapur 20 Paket Makanan Siap Saji 180, Paket Sandang 24, Paket Kids Ware 15, Paket Family Kids 15, Paket Tikar Plastik 35 lembar, bersumber dari dana APBN.",,,,,,,,,,,
403,Banjir,6/8/2013,17.00 WIB,106.819,-6.74169,Kp. Pangkalan Desa Srogol Kec. Cigombong Kab. Bogor Prov. Jawa Barat,Korban Jiwa : Nihil,Kerugian Materil : 20 rumah terendam (data sementara),Kronologis : Terjadi hujan sejak pukul 15.00 sampai dengan 19.00 WIB. Upaya : TRC turun kelapangan membantu warga yang terdampak banjir. Rencana siang ini BPBD Kab. Bogor menyalurkan logistik kepada korban banjir.,,,,,,,,,,,
404,Banjir,6/7/2013,20.00 WITA,120.295,-3.19961,Ds. Tirowali Ds. Parekeju Kec. Ponrang Kab. Luwu Prov. Sulawesi Selatan,Nihil,masih dalam pendataan,"Kronologis : - hujan lebat sejak pkl. 19.30 s/d 23.00 WITA - Datang air kiriman dari Ds. Tampah, Kec. Ponrang Upaya : - BPBD sudah berada di lokasi bencana dan masih melakukan pendataan - BPBD membantu warga untuk mengevakuasi barang milik warga yang terkena banjir Kendala : - BPBD mengalami kendala dalam evakuasi warga akibat perahu karet yang ada tidak dapat digunakan karena sering sekali mengalami kebocoran",,,,,,,,,,,
405,Banjir,6/7/2013,04.30 WIB,112.226,-7.54684,"Kec.Sumobito: Ds.Brudu, Gebangsari & Sebani Kec.Tembelang: Ds.Tampingmojo, Kedunglosari, Kedungotok, Kec.Peterongan: Ds.Peterongan, Sumberagung, Dukuhklopo. Kab.Jombang Prov.Jatim",Nihil,"- Kec. Sumobito: Ds. Brudu, Gebangsari & Sebani tergenang air di sebagian pemukiman penduduk dan areal. - Kec. Tembelang: Ds. Tampingmojo, Kedunglosari & Kedungotok . Lahan pertanian tergenang air. - Kec. Peterongan: Ds. Peterongan, Sumberagung, Dukuhklopo. Lahan pertanian tergenang air.","*Kronologi: Hujan lokal yang cukup lebat ditambah debit air yang tinggi dari K. Putih, K. Ngotok Ring Kanal dan beberapa sungai lainnya menyebabkan luberan air dan beberapa tanggul longsor di beberapa tempat. *Upaya: -BPBD memantau perkembangan banjir -BPBD menyiapkan tanggul *Kondisi Muktahir : ±30 Cm Banjir sudah mulai surut",,,,,,,,,,,
406,Banjir,6/6/2013,19.00 WITA,119.997,-4.62228,"Dusun Koppe, Desa Lili Riawang, Kec. Bengo, Kab. Bone, Prov. Sulsel","Korban Jiwa : 1 orang terbawa arus sungai atas nama Ibu Ratnasari/P/30 tahun. KOndisi Muktahir : Korban ditemukan warga dalam keadaan meninggal dunia pada tanggal 07-06-2013 pukul 19.00 WITA di Desa Barae, Kec. Mariri, Kec. Wawawo, Kab. Soteng",,"Kronologis : Korban pulang dari sawah memikul 1 karung padi dengan melewati jembatan bambu, lalu tiba-tiba korban tergelincir dan jatuh ke sungai. Upaya : Jenazah telah diantar ke rumah duka dan sudah disemayamkan.",,,,,,,,,,,
407,Banjir,6/6/2013,17:00:00 WIB,112.816,-7.63478,"Kec. Prigen Kec. Gempol Kec. Pandaan Kec. Sukorejo Kec. Rembang Kec. Beji. Kel. Kalianyar, Kel. Kalirejo, Ds. Tambakan, Ds. Masangan, Ds. Kedungringin, Ds. Manaruwi,Kec. Bangil. Kab. Pasuruan. Prov. Jawa Timur.",*Korban Jiwa : Nihil,"*Kerugian : -1 rumah tergenang air dengan ketinggian � 40 s/d 80 Cm di Kel. Kalianyar 1.3466 KK, tambak produktif 12 Ha tergenang air dengan ketingggian rata-rata 200 cm, surut Pkl. 12.00 WIB hari Kamis 06 Juni 2013 -Rumah tergenang air dengan ketinggian ± 30 s/d 80 cm di Kel. Kalirejo 445 KK, surut Pkl. 12.00 WIB hari Kamis o6 Juni 2013 -Rumah tergenang air dengan ketinggian � 40 s/d 80 cm di Desa Tambakan 625 KK, surut Pkl. 12.00 WIB hari Kamis, 06 Juni 2013 -Rumah tergenang air dengan ketinggian ± 50 s/d 100 cm di Desa Masangan 285 KK, surut Pkl. 12.00 WIB hari Kamis, 06 Juni 2013 -Rumah tergenang air di Desa Kedungringin 220 KK (Pkl. 18.00 WIB, Ketinggian air � 20 s/d 40 cm, surut Pkl. 12.00 WIB hari Kamis, 06 Juni 2013 -Jumlah korban banjir = 3.296 KK -Sawah siap panen terendam air di Desa Manaruwi seluas 40 Ha -Desa Masangan sawah siap panen terendam air seluas ± 90 Ha, dan Tambak produktif � 55 Ha","*Kronologis: Hujan di wilayah Kec. Prigen, Gempol, Pandaan, Sukorejo, Rembang, Beji dan Kec. Kecamatan Bangil, Kab. Pasuruan *Upaya : -Pada tanggal 5 Juni 2013 Tim Reaksi Cepat (TRC) BPBD bersama Muspika terdampak, Aparat Pemerintah Desa terdampak,SAR,Tagana ke Kec. Bangil dan Kec. Beji untuk melakukan pemantauan dan identifikasi -Pada tanggal 06 Juni 2013 BPBD Kab. Pasurusanmemberikan bantuan berupa pendistribuasian air bersih & makanan siap saji untuk masyarakat terdampak -Menyiagakan petugas paramedis & mobil ambulan beserta obat-obatan di Posko Banjir -Menghimbau warga masyarakat untuk selalu siaga dan segera menginformasikan kepada Aparat Pemerintah Kelurahan/Desa & Kec. Apabila ada kenaikan air, hujan susulan",,,,,,,,,,,
408,Banjir,6/6/2013,18:24:00 WIB,112.85,-7.61096,"Ds. Kedung ringin,Kec. Beji. Ds. Kalirejo Ds. Kalianyar Ds. Latek Ds. Masangan Ds. Manaruwi Ds. Tambakan,Kec. Bangil. Kab. Pasuruan. Prov. Jatim.",*Korban Jiwa : Nihil,*Kerugian Materil : Nihil,*Kronologis : Hujan Deras Upaya : Tim TRC BPBD Kab. Pasuruan melakukan identifikasi dan evakuasi akibat bencana banjir,,,,,,,,,,,
409,Banjir,6/6/2013,04:30:00 WITA,112.226,-7.54684,"Ds. Brutu Ds. Gebangsari Ds. Palrejo, Kec. Sumobito, Kab. Jombang, Prov. Jatim",*Korban Jiwa: Nihil,*Kerugian Materil: Nihil,*Kronologi: Hujan sejak jam 9 malam sampai dengan pagi hari *Upaya: -BPBD memantau perkembangan banjir -BPBD menyiapkan tanggul,,,,,,,,,,,
410,Banjir,6/6/2013,20.43 WIB,111.916,-7.68531,"Ds.Kebon Agung/Kec.Sawahan. Ds.Batembat,Ds.Banaran dan Ds. Plosoharjo Kali Bodor/Kec. Pace. Kab. Nganjuk Prov. Jatim",Nihil,"*Kerugian Materil : Banjir : _Ds. Batembat, Kec. Pace 1 jembatan penghubung antar dusun terputus akibat terdorong material sampah kayu, bambu dan limbah lainnya -Ds. Banaran, Kec. Pace 1 jembatan DAM terputus Longsor : -Menutupi badan jalan di Ds. Kebon Agung, Kec. Sawahan",*Kronologis : Banjir : DAM sungai Ds. Bodor jebol akibat 2 tanggul yang baru dibangun runtuh Longsor : Akibat hujan deras di daerah perbukitan Kebon Agung yang mengakibatkan badan jalan tertimbun longsor *Upaya : Tadi pagi BPBD melakukan rapat koordinasi lengkap bersama Bapak Bupati dan instansi terkait Banjir : -TRC BPBD Kab. Nganjuk saat ini sedang membersihkan puing sisa banjir -BPBD masih melakukan pendataan Longsor : TRC BPBD Kab. Ngajuk bersama Dinas PU membersihkan areal longsoran dengan menggunakan Beko *Kendala : Pembersihan sampah serta kayu dan bambu di pintu air terkendala peralatan,,,,,,,,,,,
411,Banjir,6/5/2013,13.37 WIB,109.683,-6.86655,"Kel. Kramat Sari, Kec. Pekalongan Barat. Panjang Baru, Pabean, Kraoiyak Lor, Krapiyak Kidul, Panjang Wetan, Kel. Kandang Panjang, Kec. Pekalongan Utara. Kel. Klego, Kec. Pekalongan Timur. Kota Pekalongan, Prov. Jawa Tengah","Korban Jiwa: Kec. Pekalongan Timur, Kel. Klego 1.233 Jiwa Kec. Pekalongan Utara, Kel. Kandang Panjang 1.488 Jiwa, Kel. Panjang Wetan 1.555 Jiwa, Kel. Krapiyak Kidul 829 Jiwa, Krapiyak Lor 1.677 Jiwa, Bandengan 1.337 Jiwa, Pabean 431 Jiwa, Panjang Baru 1.703 Jiwa Kec. Pekalongan Barat, Kel. Kramat Sari 232 KK, Kel. Pasir Sari 158 KK",Kerugian Materil: Jalur transportasi tergenang TMA 25 - 50 cm RT. 03 Kel. Bandengan sebanyak 18 rumah terendam Kel. Kandang panjang RT. 03/08 sebanyak 7 rumah terendam Kondisi Terkini : Masih Pendataan,"Kronologis : Banjir Rob terjadi sudah 2 minggu silam tetapi banjir Rob terbesar tgl 28 Mei 3013 sampai saat ini, dan banjir ini mulai pukul 16.00 sore sampai dengan 12.00 Siang air sudah mulai surut. Tidak ada pengungsi dan warga tetap tinggal dirumah masing-masing saat terjadi banjir Rob Upaya : Koramil pekalongan barat sudah melakukan peninjauan dan pendataan Situasi masyarakat normal Kendala : Terbatasnya personil dibagian LINMAS dan Penanggulangan Bencana Kendaraan roda 4 tidak dapat mencapai lokasi karena akses kelokasi tidak kondusif dan hanya bisa dijangkau",,,,,,,,,,,
412,Banjir,6/5/2013,13.37 WIB,109.683,-6.86655,"Kel. Kramat Sari, Kec. Pekalongan Barat. Panjang Baru, Pabean, Kraoiyak Lor, Krapiyak Kidul, Panjang Wetan, Kel. Kandang Panjang, Kec. Pekalongan Utara. Kel. Klego, Kec. Pekalongan Timur. Kota Pekalongan, Prov. Jawa Tengah","Korban Jiwa: Kec. Pekalongan Timur, Kel. Klego 1.233 Jiwa Kec. Pekalongan Utara, Kel. Kandang Panjang 1.488 Jiwa, Kel. Panjang Wetan 1.555 Jiwa, Kel. Krapiyak Kidul 829 Jiwa, Krapiyak Lor 1.677 Jiwa, Bandengan 1.337 Jiwa, Pabean 431 Jiwa, Panjang Baru 1.703 Jiwa Kec. Pekalongan Barat, Kel. Kramat Sari 232 KK, Kel. Pasir Sari 158 KK",Kerugian Materil: Jalur transportasi tergenang TMA 25 - 50 cm RT. 03 Kel. Bandengan sebanyak 18 rumah terendam Kel. Kandang panjang RT. 03/08 sebanyak 7 rumah terendam Kondisi Terkini : Masih Pendataan,"Kronologis : Banjir Rob terjadi sudah 2 minggu silam tetapi banjir Rob terbesar tgl 28 Mei 3013 sampai saat ini, dan banjir ini mulai pukul 16.00 sore sampai dengan 12.00 Siang air sudah mulai surut. Tidak ada pengungsi dan warga tetap tinggal dirumah masing-masing saat terjadi banjir Rob Upaya : Koramil pekalongan barat sudah melakukan peninjauan dan pendataan Situasi masyarakat normal Kendala : Terbatasnya personil dibagian LINMAS dan Penanggulangan Bencana Kendaraan roda 4 tidak dapat mencapai lokasi karena akses kelokasi tidak kondusif dan hanya bisa dijangkau",,,,,,,,,,,
413,Banjir,6/5/2013,14.03 WIB,109.61,-6.86635,"Ds. Wonokerto Kulon, Kec. Wonokerto Ds. Karang Jumpo Ds. Tegaldowo Ds. Mulyorejo Ds. Jeruksari, Kec. Tirto, Kab. Pekalongan, Prov. Jawa Tengah.",Korban Jiwa: Masih pendataan,"Kerugian Materil: Kec. Tirto, Ds. Jeruksari sebanyak 1.178 unit rumah dan 2 SD terendam Kec. Tirto, Ds. Mulyorejo sebanyak 678 unit rumah, 1 kantor kelurahan dan 1 SD terendam Kec. Tirto, Ds. Tegaldowo sebanyak 480 unit rumah terendam Kec. Tirto, Ds. Karang jumpo sebanyak 180 unit rumah terendam 60 ha tambak ikan terendam Kondisi Terakhir : TMA 10 - 30 cm yang menggenang di rumah warga","Kronologis: Hujan seharian sejak pukul 08.00 s/d 17.00 WIB Upaya: Mendroping karung plastik padat (membuat tanggul) untuk mengatasi banjir ROB Memberikan bantuan logistik kepada para korban Bikesda Sudah menyiagakan Puskemas Pembantu 24 jam DPRD didampingi SKPD terkait ada kunjungan di 3 Kecamatan (Kec. Tirto, Wonokerto, Siwalan)",,,,,,,,,,,
414,Banjir,6/5/2013,17:00:00 WIB,111.9,-7.60128,"Ds. Siwalan,Kec. Sawahan. Ds. Banaran,Ds. Batembat,Ds. Mangunsari,Ds. Mbodor,Ds. Brayung,Ds. Babat,Ds. Plosoharjo, Kec. Pace. Ds. Salamrejo,Ds. Grojogan, Ds. Tiripan,Ds. Sedangbumen,Ds. Bringgil Ds. Bendungrejo, Kec. Berbek. Kel. Bonggah, Kec. Nganjuk. Ds. Sukorejo,Kec. Loceret. Ds. Sumengko,Kec. Sukomoro. Ds. Gardu,Ds. Sekarputih, Kec. Bagor. Kab. Nganjuk, Prov. Jatim",*Korban Jiwa: Nihil,"*Kerugian Materil: Berdampak: -Ds. Batembat, Kec. Pace: -3 rumah RS -2 rumah RT (a.n Sumarji dan Jaimin) -1 Kadang Roboh -Ds. Mangunsari, Kec. Pace: -3 rumah roboh (a.n Yatim, Kambali, Munawar) -Rumah terendam 180 rmh/328 jiwa -Ds. Bendungrejo, Kec. Brebek: -1 rumah roboh (a.n Pujianto) -Pabrik tahu roboh -Dsn. Kwagean, Ds. Siwalan, Kec. Sawahan: -1 rumah roboh total (a.n muraini) -3 rumah rusak sedang -Ds. Jatirejo, Kec. Nganjuk -1 rumah rusak roboh (a.n pak sul)",*Kronologis : Hujan deras lebih dari 4 jam dan meluapnya kali kuncir dan tidak bisa menampungnya debit air yang tinggi *Upaya : -Tim reaksi cepat BPBD Kab. Nganjuk bersama instansi terkait melakukan identifikasi dampak kerusakan akibat bencana banjir -Menghimbau warga masyarakat untuk selalu siaga dan segera menginformasikan kepada aparat pemerintah desa dan kecamatan apabila ada kenaikan air -TRC BPBD Kab. Nganjuk terus mengevakuasi warga dan ternak di daerah terdampak hingga saat ini,,,,,,,,,,,
415,Banjir,6/5/2013,20.30 WIB,113.212,-7.75693,Sekitar DAS Sungai Kasbah Kab. Probolinggo Prov. Jatim,Nihil,"Jl. Soekarno-Hatta, jl. Supriyadi, Jl. Pattimura dan Jl. Taman Bahasia tergenang Kel. Pilang, tisnonegaran, Sukabumi dan Mayangan Cuaca saat ini hujan dera","Kronologis: • Terjadi hujan lebat pkl. 20.30 – 03.00 WIB, yang menyebabkan naiknya permukaan air sungai Kasbah, umbul, perhutani dan Rob sehingga terjadi banjir. Upaya: -Tim reaksi cepat BPBD Kab. Probolinggo melakukan identifikasi akibat bencana banjir",,,,,,,,,,,
416,Banjir,6/5/2013,,112.775,-7.60498,Prov. Jatim Kab. Pasuruan Kec. Bangil Ds. Manaruwi,Nihil,nihil,*Kronologis : - Hujan Deras *Upaya : - Tim TRC BPBD Kab. Pasuruan melakukan identifikasi dan evakuasi akibat bencana banjir - BPBD Kab. Pasuruan mendirikan Posko Lapangan dan Posko Kesehatan *Kondisi Muktahir : - Genangan setinggi 20-40 cm - Desa Manaruwi masih tergenang air,,,,,,,,,,,
417,Banjir,6/5/2013,17.00 WIB,112.198,-7.76542,"Kec. Loceret Ds. Ngepeh, Ds. Putuk rejo, Ds. Sukorejo, Ds. Patihan Kec. Sawahan Ds. Siwalan Ds. Bareng Kec. Sukomoro Ds. Sumengko Kec. Nganjuk Ds. Jatirejo Ds. Ploso Kec. Bagor Ds. Gandu Ds. Sekar putih Ds. Banaran, Ds. Batembat, Ds. Mangunsari, Ds. Bodor, Ds. Kecubung, Ds. Sanan, Ds. Plosoharjo Kec. Pare ,Ds. Salamrejo, Ds. Patranrejo, Ds. Grojogan, Ds. Tiripan, Ds. Sendangbumen, Ds. Bendungrejo, Ds. Cepoko, Ds. Brebek Kec. Brebek Kab. Nganjuk, Prov. Jawa Timur",Korban Jiwa : Nihil,Kerugian Materil : 1 unit jembatan putus 16 rumah roboh 10 rumah rusak berat 1 kandang ternak sapi rusak berat. 1428 Ha areal persawahan tergenang. Tafsir kerugian = Rp. 750.000.000.,"Kronologis : Curah hujan yang tinggi selama 2 hari berturut – turut (lama hujan antara 3 – 7 jam per hari), TMA kali Kuncir 2.25 pielscale dan adanya penyempitan saluran air dan pendangkalan sungai. Upaya : Menurunkan anggota TRC dan relawan peduli bencana untuk membantu penyelamatan masyarakat. Membersihkan pelayanan kesehatan gratis kepada masyarakat. Melakukan evakuasi dan relokasi korban bencana banjir. Pemberian bantuan pemenuhan kebutuhan dasar bagi korban bencana banjir antara lain : pemberian paket sembako, air bersih, makanan siap saji, dan nasi bungkus. Kerja bakti normalisasi drainase sawah. Pembersihan tanah longsor di Ds. Kebon agung, Kec. Sawahan. Pembersihan sampah di DAM Ds. Banaran, Kec. Pace. Kebutuhan Mendesak : Keterbatasan persediaan peralatan dan bahan logistik, antara lain : Bronjong, Karung plastik, Sesek dan pancang dolken serta paket Sembako dan Makanan siap saji.",,,,,,,,,,,
418,Banjir,6/4/2013,07:00 WIB,118.727,-8.46057,"Ds. Jia dan Ds. Bugis, Kec. Bima, Kab. Bima, Prov. Nusa Tenggara Barat",Korban Jiwa : 150 KK mengungsi 1 meninggal dunia,"Kerugian Materil : Longsor : Masih pendataan Kondisi Muktahir : TMA 2,5 meter Lain-lain masih dalam pendataan",Kronologis : Akibat curah hujan yang cukup lama sejak 5 hari yang lalu dan hingga saat ini Upaya : BPBD sudah mendirikan tenda pengungsian di titik banjir. BPBD Kab. Bima melakukan koordinasi kepada BPBD. Provinsi bersama instansi terkait Memberikan bantuan tanggap darurat Kendala : BPBD mengalami kekurangan kebutuhan logistik Belum bisa ke lokasi banjir karena kondisi masih belum kondusif Kebutuhan Mendesak : Air bersih Logistik,,,,,,,,,,,
419,Banjir,6/3/2013,17.00 WIB,112.842,-7.68995,"Dsn. Rujak Sente, Ds. Kalirejo, Kec. Pohjentrek Dsn. Mojoloro, Ds. Klampisrejo, Kec. Kraton, Kab. Pasuruan, Prov. Jawa Timur",Korban Jiwa : Nihil,"Kerugian : Nihil Kondisi Mutakhir : Dsn Mojoloro, Ds. Klampisrejo, Kec. Kraton, Kab. Pasuruan TMA 10 cm. Dusun Rujak Sente, Ds. Kalirejo, Kec. Pohjentrek, Kab. Pasuruan TMA 20 cm",Kronologis: Hujan dengan intensitas lebat mulai pukul 13.00-21.00 WIB tanggal 03 Juni 2013 di sekitar daerah Nongko Jajar menyebabkan air mulai menggenangi pemukiman warga pada pukul 17.00 WIB. Meluapnya dua sungai di wilayah Kab. Pasuruan yaitu Kali Welang dan Kali Kraton dengan ketinggian 10-20 cm akibat hujan lebat. Kejadian terpantau dengan baik dan pada pukul 23.00 WIB tanggal 03 Juni 2013 dilaporkan bahwa air yang menggenangi rumah sudah surut.,,,,,,,,,,,
420,Banjir,5/30/2013,02.00 WIB,111.514,-7.63103,Kel. Kelun Kel. Rejomulyo Kel. Pilangbango Kec. Balerejo Kec. Wungu Kec. Madiun Kec. Kartoharjo Kota Madiun Kab. Madiun Prov. Jawa Timur,nihil,- 263 Rumah terendam - 200 Ha sawah terendam,"Kronologis : - Meluapnya tiga sungai di wilayah Kabupaten / Kota madiun yaitu Sungai Jeroan, Sungai Sono, dan Sungai Piring meluap akibat hujan lebat. - Hujan dengan intensitas lebat selama 5 jam menyebabkan air mulai menggenangi pemukiman warga. - Tiga Sungai di Wilayah Kabupaten / Kota Madiun yaitu Sungai Jeroan, Sungai Sono, dan Sungai Piring meluap hingga terpantau pada hari Jumﾒat, 31 Mei 2013 Pkl. 12.30 WIB. - Kondisi Cuaca Hujan Deras. Upaya : - BPBD Prov. Jawa Timur memberikan bantuan Sembako.",,,,,,,,,,,
421,Banjir,5/28/2013,08.00 WITA,119.213,-3.35441,Ds. Mammi Kec. Binuang Kab. Polman Prov. Sulawesi Barat,nihil,- 50 Ha Sawah terendam - 31 Ha Tambak ikan terendam,Kronologis: - Hujan deras sehingga sungai mammi meluap - Pendangkalan sungai Upaya: BPBD setempat sudah melakukan peninjauan,,,,,,,,,,,
422,Banjir,5/28/2013,18.00 WITA,121.322,-1.41709,Kec. Suasu Kab. Parigi moutong Prov. Sulawesi Tengah,76 KK/365 Jiwa Mengungsi.,- 76 Rmh RB - 190 Rmh RR,BPBD sudah di lokasi,,,,,,,,,,,
