1,Banjir,3/29/2014,06:00 WIB,106.883,-6.2307,Kel. Kampung Melayu Kec. Jatinegara Kel. Cipinang Melayu Kel. Pinang Ranti Kel. Kebon Pala Kel. Makasar Kec. Makasar Kota Jakarta Timur Prov. DKI Jakarta,- 650 jiwa mengungsi di 2 lokasi pengungsian - 1.148 kk/4.054 jiwa terdampak,"*Kerugian Materil : - 71 Rt, 15 Rw, 5 Kelurahan di 2 kecamatan terendam air, TMA 10 -200 cm - 10 Ha Sawah terendam air di Desa Ngasinan dan 6 Sekolah Dasar terendam dengan ketinggian TMA 60 cm",*Kronologis : Hujan dengan intensitas tinggi *Upaya : BPBD melakukan pendataan,,,,,,,,,,,
2,Banjir,3/28/2014,17:00 WIB,107.746,-7.38265,Ds. Haurpanggung Kec. Tarogong Kidul Ds. Sukawangi Kec. Cisurupan Ds. Mekarjaya Ds. Mekarsari Ds. Cikandang Kec. Cikajang Ds. Sidang sari Kec. Cikeduk Kab. Garut Prov. Jawa Barat,161 KK terdampak,"Kerugian Materil : - Kec. Tarogong Kidul; 138 unit rumah di 3 Rw terkena dampak banjir bandang, TMA 60 cm - Kec. Cisurupan, 7 unit rumah RB, 3 unit rumah hanyut - Kec. Cikajang, 6 unit rumah terdampak - Kec. Cikeduk, 8 unit rumah dan 1 musholah terendam, TMA 50 cm","*Kronologis : Akibat curah hujan yang tinggi sehinga sungai cimanuk meluap *Upaya : - BPBD menyiapkan pasukan TRC, Perahu dan mesin sedot - Memberikan bantuan logistik berupa supermi 400 bungkus - BPBD saat ini masih memantau lokasi banjir - Warga saat ini mmembersihkan lumpur dari banjir badang",,,,,,,,,,,
3,Banjir,3/27/2014,09:00 WITA,116.1,-1.95293,Ds. Bekoso Kec. Pasir Belengkong Kab. Paser Prov. Kaltim,31 KK terdampak,Nihil,*Kronologis : Curah hujan yang cukup tinggi *Upaya : BPBD Paser masih melakukan pemantauan daerah yang rawan banjir,,,,,,,,,,,
4,Banjir,3/25/2014,03:00 WIB,110.864,-7.78372,Ds. Singoblutan Ds. Kaliancar Ds. Pule Kec. Selogiri Kab. Wonogiri Prov. Jateng,Pengungsi 300 jiwa tersebar di 5 titik,Masih dalam pendataan,*Kronologis : Akibat Hujan deras *Upaya : BPBD saat ini masih dilokasi untuk melakukan pendataan dan memberikan bantuan logistik,,,,,,,,,,,
5,Banjir,3/25/2014,06:00 WIB,110.846,-7.76924,Ds. Ngasinan Ds. Tiyaran Kec. Bulu Kab. Sukoharjo Prov. Jateng,Nihil,Sejumlah lahan pertanian dan beberapa rumah disekitar bantaran sungai tergenang air dengan ketinggian 20 s/d 50 cm,*Kronologis : Meluapnya kali Buntung *Upaya : Siswa dari SD terdampak untuk sementara belajar di rumah,,,,,,,,,,,
6,Banjir,3/22/2014,01:00 WITA,114.933,-3.33333,Kec. Sungai Pinang Kec. Pengaron Kec. Simpang Empat Kec. Sintapuri Kec. Sambung Makmur Kec. Mataraman Kab. Banjar Prov. Kalimantan Selatan,8.968 Jiwa terdampak,4.116 Unit rumah terendam dengan TMA 60-300 Cm,*Kronologis : Akibat hujan deras *Upaya : BPBD setempat bersama SKPD terkait sudah ke lokasi untuk melakukan pendataan dan memberikan bantuan logistik,,,,,,,,,,,
7,Banjir,3/19/2014,01:00 WIB,107.849,-6.99758,Ds. Rahayu Kec. Marga Asih Kab. Bandung Prov. Jawa Barat,12 Kk/ 43 Jiwa,25 Unit Rumah dan 1 Masjid terendam dengan TMA 20 - 60 CM,*Kronologis : Akibat hujan deras yang mengakibatkan tanggul saluran air jebol *Upaya : BPBD Beeserta masyarakat membersihkan saluran air dan memperbaiki tanggul dengan alat manual,,,,,,,,,,,
8,Banjir,3/18/2014,01:00 WIB,103.007,-3.79757,Ds. Landur Kec. Pendopo Kab. Emapatlawang Prov. Sumatra Selatan,2 Orang (MD),2 Unit Rumah (RB),*Kronologis : Akibat Hujan Deras *Upaya : BPBD telah melakukan evakuasi dan telah menyalurkan bantuan dari Dinsos,,,,,,,,,,,
9,Banjir,3/17/2014,07:00:00 WITA,115.947,-3.00298,Kab. Kota Baru Prov. kalimatan Selatan,Nihil,Kantor KPUD terendam,Upaya : Bpbd melakukan pendataan Kronologis : Akibat Hujan deras sejak pukul 05:00 - hingga 07:00 WITA,,,,,,,,,,,
10,Banjir,3/17/2014,02:00 WIB,103.365,-4.6557,Ds. Sintomadi Kec. Bermani Ilir Kab. Kepahyang Prov. Bengkulu,2 orang (MD),1 Unit Pondok petani (Saung) Hanyut terbawa air Bah.,*Kronologis : Hujan deras mengakibatkan meluapnya sungai Punggur *Upaya : BPBD kab. Kepahyang melakukan pengevakuasian korban,,,,,,,,,,,
11,Banjir,3/17/2014,17:30 WIB,112.922,-7.63177,Kel. Petamanan Kec. Panggungrejo Kota Pasuruan Prov. Jawa Timur,Nihil,Nihil,*Kronologis : Intensitas curah hujan tinggi di daerah hulu *Upaya : BPBD stand by dan memantau debit air sungai Gembong mulai pukul 16:15 WIB - Mengerahkan personel BPBD dan relawan untuk melakukan pendataan,,,,,,,,,,,
12,Banjir,3/15/2014,24:00 WIB,104.752,-4.81339,Kel.Sri Basuki Kel.Cempedak Kec.Kotabumi Kota Kel.Tanjung Aman Kel.Tanjung Selatan Kec.Kotabumi Selatan Kab.Lampung Utara Prov.Lampung,Nihil,143 Unit rumah terendam,*Kronologis : Akibat hujan deras *Upaya : BPBD setempat sudah ke lokasi untuk melakukan pendataan dan evakuasi,,,,,,,,,,,
13,Banjir,3/13/2014,15:30 WIB,117.594,-8.63252,Ds. Dete Ds. Dete Atas Ds. Dete Bawah Kec. Lape Kab. Sumbawa Prov. NTB,Nihil,Masih dalam pendataan,*Kronologis : Akibat hujan deras *Upaya : BPBD setempat sudah ke lokasi untuk melakukan pendataan dan evakuasi,,,,,,,,,,,
14,Banjir,3/12/2014,22:00 WIB,107.802,-6.95195,Ds. Sukadana Ds. Cihanjuang Ds. Mangunharja Ds. Sawah Dadap Kec. Cimanggung Kab. Sumedang Prov. Jawa Barat,Nihil,Merendam 4 desa (banjir sudah surut kembali),*Kronologis : Hujan dengan intensitas tinggi *Upaya : Muspika dan masyarakat sudah antisipasi dikarenakan daerah tersebut memang langganan banjir,,,,,,,,,,,
15,Banjir,3/11/2014,15:30 WIB,110.675,-7.66908,Ds. Ceper Kec. Ceper Kab. Klaten Prov. Jawa Tengah,Nihil,"1 Sekolah Dasar, 1 taman Kanak - Kanak (Pertiwi), 4 Rumah warga terendam air setinggi 10 - 30 cm",*Kronologis : Akibat hujan deras *Upaya : BPBD bersama warga bergotong royong membersihkan air dan lumpur di lokasi kejadian.,,,,,,,,,,,
16,Banjir,3/9/2014,16:00 WIB,108.297,-7.24109,Ds. Mekarjati Kec. Sadananya Kab. Ciamis Prov. Jawa Barat,Nihil,1 Unit rumah (RB) dan 2 Unit rumah (RS),*Kronologis : Hujan lebat sehingga mengakibatkan meluapnya air dan jebolnya bibir Sungai Cileueur *Upaya :Masyarakat dan BPBD Kab. Ciamis maupun relawan bergotong - royong membantu korban dan menyalurkan sembako bantuan dari BPBD Prov. Jabar,,,,,,,,,,,
17,Banjir,3/9/2014,12:00 WIB,113.88,-6.93322,Perum.Desa Batuan Ds.Batuan Kec.Batuan Kab.Sumenep Prov.Jawa Timur,Nihil,-Jalan Raya sepanjang 750 meter (RB) -1 Pondok pesantren (RS) -Jalan utama penghubung antar desa putus (RB),*Kronologis: -Hujan lebat yang cukup lama dilokasi kejadian bencana berlangsung *Upaya: -BPBD setempat bersama masyarakat membersihkan jalan yang rusak,,,,,,,,,,,
18,Banjir,3/9/2014,01:00 WIB,107.415,-6.88464,Ds. Cipangeran Kec. Saguling Kab. Bandung Barat Prov. Jawa Barat,"- Di Kp. Kesbang, 3 KK / 8 Jiwa mengungsi - Di Kp. Cipeundeuy, 2 Jiwa mengungsi - Kp. Cikuda, 3 Jiwa mengungsi","- Di Kp. Kesbang, 1 Unit rumah (RB), 2 Unit rumah (RR) - Di Kp. Cipeundeuy, 1 Unit rumah (RB) - Kp. Cikuda, 1 Unit rumah (RS) - Kp. Cibeying, Kp. Cukang Batu, Kp. Cimentrik 13 Unit rumah (RR)",*Kronologis : Hujan lebat yang cukup lama *Upaya : BPBD setempat melakukan koordinasi untuk penanganan dan pengevakuasian korban yang terkena dampak banjir,,,,,,,,,,,
19,Banjir,3/7/2014,19:00 WIB,106.8,-6.6,RT.01/02 Kp. Cijayanti Ds. Cijayanti Kec. Babakan Madang Kab. Bogor Prov. Jawa Barat,- 5 KK/21 Jiwa,- 3 unit Rumah Terendam,*Kronologis : - Akibat hujan deras *Upaya : -Tim TRC BPBD Kab. Bogor sebanyak 15 orang masih stand by dilapangan untuk mengantisipasi banjir susulan. *Kondisi Mutakhir: - TMA 80 cm,,,,,,,,,,,
20,Banjir,3/7/2014,18:00 WIB,107.91,-7.35703,Ds. Karang Pawitan Kec. Patrol Kab. Garut Prov. Jawa Barat,Nihil,"4 Ha sawah terendam, 5 unit rumah terendam, dan 1 rumah RR",*Kronologis : Akibat Hujan deras *Upaya : BPBD setempat sudah ke lokasi kejadian untuk melakukan pendataan dan mengevakuasi warga,,,,,,,,,,,
22,Banjir,3/4/2014,13:45 wib,110.222,-7.46398,Ds. Wonolelo Kec. Sawangan Kab. Magelang Prov. Jawa Tengah,nihil,nihil,* Kronologis : - Akibat hujan *Upaya : - BPBD Kab. Magelang melakukan pemantauan sepanjang Sungai Pabelan dari hulu s/d hilir,,,,,,,,,,,
23,Banjir Bandang,3/4/2014,22:00 WIB,108.214,-7.32795,RT. 012/06 Kamp. Canukur Ds. Pakalongan Kec. Sodong hilir Kab. Tasikmalaya Prov. Jawa Barat,nihil,- 1 rumah Rusak Berat - 1 Kandang Ayam Rusak Berat - 1 Musholah Rusak Sedang - 9 Kolam Ikan Rusak Berat - 5 Rumah Rusak Sedang - 2 Ha Sawah Gagal panen dan rusak,"* Kronologis : - akibat hujan deras, disertai longsoran yang menutup aliran sungai cicanukur, sehingga Sungai Cicanukur meluap. * Upaya : - BPBD bersama Relawan, TNI, POLRI, dinas PU dan warga setempat bergotong royong melakukan evakuasi dan pembersihan. - BPBD memberikan bantuan logistik berupa sembako dan alat-alat dapur.",,,,,,,,,,,
24,Banjir,3/3/2014,02:00 wib,106.8,-6.6,RT.01/02 RT.04/12 Kel. Cibinong Kec. Cibinong Kab. Bogor Prov. Jawa Barat,nihil,Nihil,*Kronologis : - Akibat hujan deras *Upaya : - Tim BPBD Kab. Bogor sudah berada dilapangan dan diperkuat dengan 3 unit Perahu.,,,,,,,,,,,
25,Banjir,3/3/2014,03:20 WIB,107.608,-6.91486,Jl. Cingised Perempatan Gedebage Kota Bandung Prov. Jawa Barat,nihil,- Perempatan Gedebage TMA 50-70 cm untuk ke arah timur & Perempatan Gedebage TMA 50-100 cm untuk ke arah utara. - Jl. Cingised TMA 20 cm,*Kronologis : - Akibat hujan deras *Upaya : - masih melakukan pendataan,,,,,,,,,,,
26,Banjir,3/2/2014,21:30 WIB,107.608,-6.91486,Ds. Balenendaha Kec. Bojongsoang Kec. Dayeuhkolot Kab. Bandung Prov. Jawa Barat,- 25 jiwa mengungsi,Nihil,"*Kronologis : - Akibat hujan deras *Upaya : - BPBD setempat bersama TNI/Polri sudah ke lokasi untuk mengevakuasi korban dan memberikan bantuan berupa makanan instan, makanan siap saji, dan family kids. *Kondisi Mutakhir : -Air sudah berangsur-angsur surut",,,,,,,,,,,
27,Banjir,3/2/2014,21:30 WIB,107.608,-6.91486,Kec. Baleendah Kec. Bojongsoang Kec. Dayeuhkolot Kab. Bandung Prov. Jawa Barat,- Kec. Baleendah = Gd. Relawan terdapat 19 KK/89 Jiwa (2 Manula dan 7 Balita). = GOR Kel. Baleendah (Masih dalam pendataan) = Rusunawa 20 KK -Kec. Bojongsoang = Gudang Tanggo 20 KK. = Kec. Dayeuhkolot = SMP Binanegara KL. 20 KK = Kantor Kecamatan (Masih dalam pendataan) = Kantor Koramil Dayeuhkolot (Masih dalam pendataan),nihil,"*Kronologis : - Akibat hujan deras *Upaya : -Pendistribuan logistik berupa (Family kit, Mie Instan, air mineral, susu dan makanan bayi, makanan siap saji dan pendataan) - sampai saat ini BPBD Kab. Bandung di bantu TNI atau Polri dan relawan masih melakukan upaya evakuasi dan pendataan. *kondisi Mutakhir : - TMA masih belum surut - cuaca mendung - Jumlah pengungsi bertambah",,,,,,,,,,,
28,Banjir,3/2/2014,06:00 WIB,106.869,-6.2733,Kel. Cililitan Kec. Kramat Jati Kota Jakarta Timur Prov. DKI Jakarta,- Terdampak :sebanyak 39 KK /141 Jiwa dengan rincian sbb : - RW.06 - RT. 001(40 KK/120 Jiwa) - RT. 003(21 KK/76 Jiwa) - RT. 004(25 KK/100 Jiwa) - RW.07 - RT. 001(5 KK/15 Jiwa) - RT. 006(33 KK/110 Jiwa) - RT. 007(3 KK/12 Jiwa) - RT. 008(10 KK/40 Jiwa) - RT. 012(5 KK/15 Jiwa) = RW.015 -RT. 001(5 KK/15 Jiwa) = RW.016 - RT. 008(30 KK/120 Jiwa) -RT. 010(5 KK/20 Jiwa),Dalam pendataan,"*Kronologis : - Hujan dengan intensitas tinggi *Upaya : - BPBD setempat melakukan pendataan jumlah yang terdampak - Warga diungsikan ke rumah warga, musholah, masjid, sekolah dan PAUD - Membuka Posko kesehatan tidak jauh dari pengungsian. *Kondisi Mutakhir : -RW. 06, TMA 50-100 cm - RW. 07, TMA 50-150 cm - RW. 015, TMA 50 cm - RW. 016, TMA 50 cm",,,,,,,,,,,
29,Banjir,3/2/2014,06.00 WIB,106.869,-6.2733,Kel. Cililitan Kec. Kramat Jati Kota Jakarta Timur Prov. DKI Jakarta,- Terdampak : Sebanyak 39 KK /141 Jiwa dengan rincian sbb : - Rw.6, 17 KK /55 Jiwa - Rw 7, 20 kk/79 jiwa - Rw 16, 2 kk/6 jiwa,Dalam pendataan,,,,,,,,,
30,Banjir,3/2/2014,02:00 wib,105.267,-5.45,Kel. Kalibata Kencana Kec. Sukabumi Kota Bandar Lampung Prov. Lampung,nihil,rumah dari 50 kk terendam air setinggi 1 m,*Kronologis : - Hujan dengan intensitas tinggi *Upaya : - BPBD setempat sdh kelokasi untuk pendataan,,,*Kronologis : Akibat hujan deras *Upaya : BPBD setempat sudah ke lokasi untuk melakukan pendataan dan evakuasi,,,,,,,,
31,Banjir,3/1/2014,09:00 WIB,107.759,-6.57159,Kec. Legon Kulon Ds. Karang Mulya Makam Panjang Kamp. Padak Kamp. Wanajaya Kec. Pusaka Negara Ds. Patimban Kamp. Galiah Kamp. Siwalah Kab. Subang Prov. Jawa Barat,nihil,Nihil,"*Kronologis : - Akibat hujan dengan intensitas tinggi menyebabkan Sungai Cipunegara meluap dan tanggul jebol *Upaya : - Satlak masih terus mendata, memantau dan memberikan bantuan logistik seperti makanan, sandang dan karung untuk tanggul. *Kondisi Mutakhir : -air sudah mulai surut tetapi masih ada genangan setinggi 10-40 cm",,,,,,,,,,,
32,Banjir,3/1/2014,21:00 WIB,111.514,-7.62971,Ds. Buduran Ds. Ngadirejo Kec. Wonoasri Kab. Madiun Prov. Jawa Timur,nihil,300 unit rmh terendam air setinggi 40-60 cm,*Kronologis : - Hujan deras *Upaya : - BPBD setempat sdh kelokasi untuk membersihkan pohon-pohon yang tumbang di jalan dan melakukan pendataan,,,,,,,,,,,
33,Banjir,3/1/2014,06.00 WIB,106.846,-6.20876,Kota Jakarta Timur Kota Jakarta Selatan Kota Jakarta Barat Prov. DKI Jakarta,- Total pengungsi 283 Jiwa tersebar di 13 lokasi dengan perincian sbb : &#61692, Jakarta Timur 78 Jiwa tersebar di 9 lokasi &#61692, Jakarta Selatan Nihil &#61692, Jakarta Pusat Nihil &#61692, Jakarta Barat 205 Jiwa di 4 lokasi &#61692,,,,,,,,,
35,Banjir,2/8/2014,21.00 WIB,113.153,-7.74399,Desa Banjarsari Kec. Sumber Asih Kab. Probolinggo Prov. Jawa Timur,Nihil,8 rumah tergenang,"*Kronologis : Hujan di wilayah selatan, Menyebabkan sungai Patalan meluap. *Upaya : BPBD Kabupaten Probolinggo pagi ini sedang melakukan pengecekan kembali.",,,,,,,,,,,
36,Banjir,2/8/2014,21.00 WIB,113.196,-7.79582,"Kel.Sumberwetan, Kel. Karenglor Kel. Kedopok Kec. Kedopok Kota Probolinggo Prov. Jawa Timur",Nihil,200 rumah tergenang,"*Kronologis : Tgl 8 Februari malam, plengsengan sungai Legundi Kec. Kedopok jebol 10-15M. Masuk kepemukiman dengan tinggi air 60-70cm. Penyebabnya air kiriman dari kab. Probolinggo. *Upaya : - BPBD Probolinggo menyiapkan makanan siap saji, dapur umum, - Kerja bakti bersih-bersih rumah penduduk dan pintu air sungai Legundi beserta pramuka, batalion timur, koramil, tagana, PMI, Dinas PU.",,,,,,,,,,,
37,Banjir,2/6/2014,13.00 WIB,109.67,-6.88289,Ds.Pasirsari Ds. Kramatsari Kec.Pekalongan Barat Kel. Pabean Kel.Bandengan Kec.Pekalongan Utara Kelurahan Banyuurip Kelurahan Buaran Kec.Pekalongan Selatan Kota pekalongan Provinsi. Jawa tengah,Korban Jiwa - Nihil Kerugian Materil - Masih dalam pendataan,Masih dalam pendataan,Kronologis : - Akibat hujan deras dan Sungai setu Meluap Upaya : - BPBD Setempat masih melakukan tindakan Assesment,,,,,,,,,,,
38,Banjir,2/4/2014,17.00 WIB,109.127,-6.86939,Ds. Sukosari Kec. Bojong Kab. Tegal Prov. Jawa Tengah,Nihil,Jembatan Penghubung Kec. Bojong ke Kec. Bumijawa Ambruk / Putus,*Kronologis: Akibat hujan deras *Upaya: - BPBD Jawa Tengah beserta SKPD terkait melakukan kesiapsiagaan sebagai antisipasi apabila terjadi bencana. - BPBD Prov. Jateng melakukan pemantauan melalui Posko AJU selama 24 jam untuk mengetahui kondisi terkini penanganan bencana di Kab seﾖJateng,,,,,,,,,,,
39,Banjir,2/4/2014,19.00 WIB,112.741,-7.53632,Ds. Wunut Ds. Pesawaan Ds. Candipari Kec. Porong Ds. Kalisampurno Ds. Gempolsari Kec. Tanggulangin Kab. Sidoarjo Prov. Jawa Timur,Nihil,masih dalam pendataaan,*Kronologis : Akibat pintu air milik BPLS di sungai Ketapang tidak bisa dibuka ditambah dengan hujan dan kiriman air dari hulu Mojokerto sehingga air meluber ke perumahan warga mencapai ketinggia 20-30 cm *Upaya : BPBD Kab. Sidoarjo masih mengusahakan untuk membuka pintu air milik BPLS tersebut agar air bisa mengalir kembali,,,,,,,,,,,
40,Banjir,2/1/2014,08:00 WIB,109.612,-6.9719,Ds. Pantai Anom Ds. Wiroditan Ds. Bukur Ds. Randu Murti Waren Ds. Legok Clili Ds. Wangan Dowo Ds. Sembing Jambu Ds.Bojong Lor Kec. Bojong Kab. Pekalongan Prov. Jawa Tengah,Pengungsi (dalam pendataan),Dalam pendataan,*Kronologis : Akibat hujan deras *Upaya : BPBD setempat dan BPBD Prov. Jawa Tengah sudah ke lokasi untuk membantu warga dan melakukan pendataan,,,,,,,,,,,
41,Banjir,2/1/2014,,109.462,-6.88483,Kec. Bodeh Kec. Comal Kec. Ulujami Kec. Ampel Gading Kec. Taman Kec. Petarukan Kec. Pemalang Kab. Pemalang Prov. Jawa Tengah,3.000 jiwa ditempatkan pada 13 titik pengungsian.,"Jembatan Tedagung terputus, 37 unit rumah rusak berat (RB) dan 143 unit rumah rusak ringan",*Kronologis : Akibat hujan deras dan Kali Polaga meluap *Upaya : BPBD setempat sudah ke lokasi untuk membantu warga dan melakukan pendataan,,,,,,,,,,,
42,Banjir,1/31/2014,19:32 WIB,112.524,-7.85997,Ds. Ngantang Kec. Pujon Kota. Batu Prov. Jawa Timur,1 orang hanyut,10 Backhoe (alat berat) hanyut dan beberapa warung makan hanyut (dalam pendataan),*Kronologis : Hujan deras *Upaya : BPBD Kota Batu sedang melakukan evakuasi *Kondisi Mutakhir : Saat ini banjir bandang masih terjadi,,,,,,,,,,,
43,Banjir,1/30/2014,19:00 WIB,113.632,-7.75157,Ds. Paowan Kec. Mladingan Kec. Panarukan Ds. Pesisir Kec. Besuki Ds. Lubawang Kec. Banyuglugur Ds. Selowogo Kec. Bungatan Ds. Klatakan Ds. Kendit Kec. Kendit Kab. Situbondo Prov. Jatim,"Terdampak ; - Kec. Kredit; Ds. Klatakan 214, Ds. Kendit 99 kk - Kec. Bungatan; Ds. Selowogo 275 kk - Kec. Banyuglugur; Ds. Lubawang 58 kk - Kec. Besuki; Ds. Pesisir 4 kk RB (ROB) - Kec. Mladingan 5 kk - Kec. Panarukan; Ds. Paowan 6 kk",5 Kecamatan terendam air dengan TMA 50 - 100 cm (dalam pendataan),*Kronologis : Hujan deras *Upaya : BPBD Kab. Situbondo melakukan evakuasi kepada korban dan pendataan,,,,,,,,,,,
44,Banjir,1/30/2014,,114.046,-6.92044,Ds. Dependa Kec. Batang - batang Kab. Sumenep Prov. Jawa Timur,Nihil,7 rumah (RR),"*Kronologis : Hujan deras *Upaya : BPBD Kab. Sumenep di bantu oleh PT. Gudang Garam mengirim bantuan sembako dan makanan siap saji 1 Paket, Lauk Pauk 1 Paket dan Tambahan Gizi 1 Paket",,,,,,,,,,,
45,Banjir,1/29/2014,,106.349,-6.1481,Ds. Gembor Kec. Binuang Kab. Serang Prov. Banten,Nihil,260 KK terendam dengan TMA 50 - 60 cm,"*Kronologis : Hujan deras *Upaya : BPBD mengirimkan logistik, mengevakuasi dan melakukan pendataan",,,,,,,,,,,
46,Banjir,1/29/2014,02:00 WIB,106.698,-6.22525,Perum. Total Persada Kec. Priuk Perum. Ciledug Indah Satu Ds. Madurenan Kec. Karang Tengah Kota. Tangerang Prov. Banten,- Kec. Karang Tengah : 1 orang meninggal dunia dan ﾱ 500 - 1000 Jiwa mengungsi - Kec. Priuk : 1000 Jiwa mengungsi,masih dalam pendataan,"*Kronologis : Hujan deras *Upaya : -Dinas Damkar kota tangerang sudah melakukan evakuasi dan memberikan bantuan logistik, - Dinsos sudah memberikan bantuan makanan - Dinkes memberikan pengobatan kepada para korban *Kondisi Mutakhir : - Kec. Priuk : 100 - 150 cm - Kec. Karang Tengah : 50 - 100 cm",,,,,,,,,,,
47,Banjir,1/28/2014,03.00 WIB,113.037,-7.12089,Ds. Blega Kec. Blega Kab. Bangkalan Prov. Jatim,25 kk dievakuasi ke tempat aman,500 rmh terendam banjir,"*Kronologis : Banjir kiriman dari gunung *Upaya : BPBD Kab. Bangkalan melakukan evakuasi korban banjir, melakukan pendataan (assesment) dan membantu Polri melakukan pengaturan lalulintas",,,,,,,,,,,
48,Banjir,1/24/2014,21.00 WITA,125.622,3.42445,Ds. Laine Kec. Manganitu Selatan Kab. Sangihe Prov. Sulut,Dalam pendataan,Dalam pendataan,"*Kronologis : Hujan deras disertai angin *Upaya : - Kalak BPBD Kab. Sangihe telah menyampaikan kepada Ka.Desa agar segera mengungsikan masyarakat ke tempat tinggi dan aman, - Sudah koordinasi dengan Camat setempat dan Kodim, - BPBD Kab. Sangihe sedang menuju lokasi sekitar 2 jam perjalanan darat",,,,,,,,,,,
49,Banjir,1/23/2014,08:00 WIB,110.325,-6.9645,Kec. Tembalang Kec. Ngaliyan Kec. Candisari Kec. Lempongsari Kec. Semarang Barat Kec. Tringkil Baru Kec. Trangkil Sejahtera Kec. Genuk Kec. Semarang Timur Kec. Tugu Kec. Semarang Utara Kota Semarang Prov. Jawa Tengah,Nihil,- Kec. Trangkil Baru : 32 unit rumah rusak berat - Kec. Trangkil Sejahtera : 11 unit rumah rusak berat,"*Kronologis: Akibat hujan deras *Upaya: BPBD saat ini sedang melakukan pemantuan ke lokasi yang rawan, mendistribusikan logistik, dan melakukan evakuasi *Kondisi Mutakhir : TMA 50-70 cm",,,,,,,,,,,
50,Banjir,1/23/2014,09:00 WIB,110.872,-7.04461,Ds. Ringinharjo Ds. Tlogomulyo Kec. gubug Ds. Lemah Putih Kec. Brati Kab. Grobogan Prov. Jawa tengah,Nihil,- Ds. Lemah Putih : 143 unit rumah tergenang - DS Tlogomulyo : 500 unit rumah tergenang air setinggi 20-30 cm - Ds. Ringinharjo : 450 unit rumah terendam air setinggi 20-30 cm,*Kronologis: Akibat hujan deras *Upaya: BPBD saat ini sedang melakukan pemantuan ke lokasi yang rawandan melakukan pendataan,,,,,,,,,,,
51,Banjir,1/23/2014,21:00 WITA,115.129,-8.17349,Ds. Galungan Kec. Sawan Ds. Sudaji Kec. Sawan Ds. Silangjana Kec. Sukasada Kab. Buleleng Prov. Bali,62 jiwa mengungsi dan 1 orang hanyut a.n. Komang Ayu (16 Thn).,"- Ds. Sawan : 1 buah motor hanyut - Ds. Sudaji : 13 unit rumah rusak berat (RB), 2 unit rumah rusak sedang (RS) dan 2 buah sepeda motor hanyut - Ds. Lokapaksa : 1 orang meninggal dunia (MD) - Ds. Silangjana : 2 buah motor hanyut",*Kronologis : Hujan deras dengan intensitas tinggi *Upaya : BPBD sudah saat ini masih di lokasi kejadian untuk melakukan evakuasi dan pendataan,,,,,,,,,,,
52,Banjir,1/23/2014,23.00 WITA,120.819,1.05821,Ds. Pangkung Ds. Bambapun Kec. Dondo Ds. Bajugan Ds. Tende Ds. Sabang Kec. Galang Kel. Panasaka Kec. Baolan Kab. Tolitoli Prov. Sulawesi Tengah,Kec. Dondo : - 35 KK di Ds. Pangkung terkena dampak banjir setinggi 1 meter dan 25 KK di Ds. Bambapun terkena setinggi 1 meter,"Kec. Galang: - 1 Sekolah SMP Bajugan terendam banjir setinggi 0,70 meter - 1,20 meter di Ds. Bajugan dan Kantor Ds. Aung terendam banjir setinggi 60 cm - Pekarangan rumah rumah warga terendam banjir setinggi 50 cm - 1,5 meter di Ds. Tende, -4 rumah penduduk terkena dampak Longsoran setinggi 50 cm - 1 meter dan jalan raya terkena dampak longsoran setinggi 20 cm - 40 cm dari Gn. Sabang di Ds. Sabang. Kec. Baolan : - Kel. Panasakan 2 rumah atas nama pemilik Boy Matualiege dan Along terkena dampak musibah Longsor yang mengakibatkan bangunan tidak layak huni",*Kronologis: Akibat hujan deras. *Upaya: Korban terkena dampak banjir mengungsi ke tempat yang lebih tinggi,,,,,,,,,,,
53,Banjir,1/22/2014,02:00 WIB,110.642,-6.8909,Ds. Mijen Ds. Pecuk Kec. Mijen Kab. Demak Prov. Jawa Tengah,Sudah tidak ada pengungsi,ﾕ Ds. Mijen: ﾱ 600 rumah terendam dengan TMA 50 cm ﾕ Ds. Pecuk: ﾱ 590 rumah terendam dengan TMA 50 cm,"*Kronologis: ﾕ Curah hujan tinggi sehingga air Sungai SWD 1 dan SWD 2 meluap *Upaya: ﾕ BPBD Kab. Demak bersama jajaran terkait terus melakukan pemantauan dilokasi bencana ﾕ membantu warga masyarakat mengamankan barang berharga ﾕ bersama masyarakat melakukan penguatan dan peninggian tanggul dengan karung /zak. ﾕ BPBD Kab. Demak melakukan dropping logistik berupa beras, mie instan, dan telor",,,,,,,,,,,
54,Banjir,1/22/2014,,108.557,-6.75331,Kec. Kosambi Kec. Lemah Wungkuk Kec. Harjamukti Kota Cirebon Prov. Jabar,Masih dalam pendataan,- Kerugian Materil : - Kec. Kosambi TMA 1 m - Kec. Lemah Wungkuk TMA 1 m - Kec. Harjamukti TMA 2 buah motor,*Kronologis : Hujan deras dengan intensitas tinggi *Upaya : Pemeritah setempat dibantu koramil kota Cirebon melakukan pendataan,,,,,,,,,,,
55,Banjir,1/21/2014,14:00 WIB,113.858,-7.00956,Ds. Arjasa Ds. Angon - angoan Ds. Laok Cengceng Ds. Bilis - bilis Kec. Arjasa Kab. Sumenep Prov. Jawa Timur,Nihil,ﾕRatusan Ha Sawah terendam ﾕ2 Sepeda motor hanyut,*Kronologis : ﾕHujan deras *Upaya : ﾕBPBD berkoordinasi dengan Muspika dan Relawan setempat untuk melakukan pendataan,,,,,,,,,,,
56,Banjir,1/21/2014,21:00 WIB,107.759,-6.57159,Kec. Pamanukan Kec. Pusaka Jaya Kec. Compreng Kec. Blanakan Kec. Tambakdahan Kec. Sukasari Kec. Legon Kulon Kec. Pabuaran Kec. Ciasem Kec. Pusakanagara Kec. Patok Beusi Kec. Pagaden Kec. Binong Kab. Subang Prov. Jawa Barat,ﾕ Kec. Pamanukan: 5.269 KK/36.132 jiwa terdampak ﾕ Kec. Pusaka Jaya: 5.148 KK/36.122 jiwa terdampak ﾕ Kec. Compreng: 2.800 KK/20.345 jiwa terdampak ﾕ Kec. Blanakan: 8.772 KK/47.436 jiwa terdampak ﾕ Kec. Tambakdahan: 3.750 KK/23.340 jiwa terdampak ﾕ Kec. Sukasari: 5.909 KK/12.797 jiwa terdampak ﾕ Kec. Legon Kulon: 5.129 KK/8.654 jiwa terdampak ﾕ Kec. Pabuaran: 495 KK/1.431 jiwa terdampak ﾕ Kec. Ciasem: 967 KK/1.932 jiwa terdampak,"ﾕ Kec. Pamanukan: 8.421 rumah, 72 rumah RB, 1.048 Ha sawah, 5,5 Ha kolam, 3 tanggul jebol, 62 bangunan umum ﾕ Kec. Pusaka Jaya: 3.922 rumah, 40 rumah RB, 1.730 Ha sawah, 2 tanggul jebol, 10 bangunan umum ﾕ Kec. Compreng: 1.370 rumah, 11 rumah RB, 835 Ha sawah, 19 bangunan umum ﾕ Kec. Blanakan: 6.880 rumah, 69 rumah RB, 2.437 Ha sawah, 1.651 Ha kolam, 2 tanggul jebol, 57 bangunan umum ﾕ Kec. Tambakdahan: 1.757 rumah, 5 rumah RB, 1.305 Ha sawah, 17 bangunan umum ﾕ Kec. Sukasari: 5.909 rumah, 32 rumah RB, 2.301 Ha sawah, 680 Ha kolam, 8 tanggul jebol, 46 bangunan umum ﾕ Kec. Legon Kulon: 5.045 rumah, 9 rumah RB, 1.030 Ha sawah, 468 Ha kolam, 1 tanggul jebol, 39 bangunan umum ﾕ Kec. Pabuaran: 440 rumah, 2 rumah RB, 178 Ha sawah, 19 bangunan umum ﾕ Kec. Ciasem: 644 rumah, 14 rumah RB, 980 Ha sawah, 13,5 Ha kolam, 27 bangunan umum",Kronologis: ﾕ hujan deras Upaya: ﾕ BPBD sudah meninjau lokasi dan melakukan pendataan,,,,,,,,,,,
57,Banjir,1/21/2014,14:00 WIB,110.642,-6.8909,Ds. Wonorejo Ds. Ketanjung Kec. Karanganyar Kab. Demak Prov. Jawa Tengah,Nihil,- Masih proses inventarisasi Damage and Losses Assessment (DaLA),"*Kondisi Mutakhir : - Masih ada genangan air di permukiman Desa Wonorejo dengan ketinggian air ﾱ 10 - 20 cm - Pengungsi sdh pulang ke rmh *Kronologis : Meluapnya air Sungai Serang *Upaya : - BPBD Kab. Demak bersama jajaran terkait terus melakukan pemantauan dan pendataan di lokasi bencana - Untuk memenuhi kebutuhan makan minum korban banjir, BPBD KAb. Demak sdh mendorong logistik melalui kecamatan/desa - Dinas Kesehatan melakukan pemantauan dan surveiland bagi korban banjir - BPBD Kab. Demak beserta SKPD terkait masih melakukan perhitungan kerusakan dan kerugian akibat bencana (DaLA)",,,,,,,,,,,
